Title,Location,Company,Salary,Summary
Data Integration Engineer - Remote,None,"Inteliquet, Inc",Full-time,"Detail-oriented and proficient in data analysis, with a keen interest in data manipulation and ability to see beyond the data and draw conclusions."
"Principal Bioinformatics Data Scientist, Liquid Biopsy",None,Tempus,"$180,000 - $250,000 a year",Communicate with outside scientific teams as well as product and scientific leadership.
Software Engineer,Remote,"Gencove, Inc.",None,"The role entails developing scalable analysis pipelines, backend web services, and tooling for low-pass sequencing data."
Curation Scientist Step II,None,Fulgent Therapeutics Llc,"$95,000 - $110,000 a year","Compared to Step 1, GCS Step 2 has more responsibilities in research & development, must be approved by a laboratory director to perform del/dup analysis, and…"
ServiceNow Developer,None,Axle Informatics,Full-time,"Bachelor’s degree in computer science, information technology, computer information systems, or a similar field,."
Genomics Software Engineer,None,"TileDB, Inc.",Full-time,"Experience with the analysis analysis of high-throughput sequencing data (e.g., quality control, mapping, variant calling)."
Sr. DevOps Engineer,None,Axle Informatics,Full-time,"Planning, analysis, design, implementation and maintenance of networks, virtual machines, container solutions, storage, open source applications, and variety of…"
