Title,Location,Company,Salary,Summary
Biostatistician (PhD or Masters degree in Statistics),Remote,"IT Engagements,Inc.",$50 - $51 an hour,Prepares statistical analysis plans in both slide and text form.
Post Doctoral Associate,"Remote in Worcester, MA 01605",University of Massachusetts Medical School,None,"PhD in cellular and molecular biology, cellular and molecular physiology, biochemistry or related biological/biomedical science."
"Principal Scientist, Machine Learning / Protein Design","Remote in New York, NY",Ordaos Bio,None,"Ph.D. in computer science, engineering, statistics, structural bioinformatics, or similar with 8+ years of relevant experience."
Genomics Software Engineer,"Remote in Cambridge, MA","TileDB, Inc.",None,"Experience with the analysis analysis of high-throughput sequencing data (e.g., quality control, mapping, variant calling)."
Software Engineer,Remote,"Gencove, Inc.",None,"The role entails developing scalable analysis pipelines, backend web services, and tooling for low-pass sequencing data."
Scientist - Data Management and Communications,"Remote in Takoma Park, MD",Gryphon Scientific,None,"In leading these projects, a Scientist should be able to independently devise project methodology, oversee multidisciplinary teams, communicate effectively with…"
Sr. DevOps Engineer,"Remote in Rockville, MD 20852",Axle Informatics,None,"Planning, analysis, design, implementation and maintenance of networks, virtual machines, container solutions, storage, open source applications, and variety of…"
Postdoctoral Fellow - Psychiatric Genetics/Addiction,"Remote in Bethesda, MD 20814",The Henry M. Jackson Foundation for the...,"$47,600 - $60,000 a year","Candidates with skills in data management and analysis (R, Python, SAS), computer science (R, Python, Linux) and statistics are strongly encouraged to apply."
